{"metadata":{"binding_hash":"b2355353e18118ed7aa32411275b7363e965e77441be3e60951684d6753fe1d4","invocation_binding":{"format":"aelitium-invocation-binding-v1","hash_sha256":"97e9f4ebc62f3a9bcc6532e8eff865ac7f9b739769544a4ea441ec76666704fe","invocation_hash":"e2149c0d3002db2194c397ca1fa3e514db0e2d180119f542292b70b09cc432ba","response_hash":"cc3c15fbdc0d62f082b50e1d566174c1878b002d5a83428622b0e5d7cc5d4094"},"invocation_identity":{"format":"aelitium-invocation-v1","hash_sha256":"e2149c0d3002db2194c397ca1fa3e514db0e2d180119f542292b70b09cc432ba","mode":"sync_non_streaming","request":{"messages":[{"content":"frozen v0.3 request","role":"user"}],"model":"shared-model"},"surface":"openai.chat.completions"},"provider":"compare-test","request_hash":"31cd3d3a9bd0a9af3230b247495f253b8fe3331f6efb4bee8bce4f4a3ac3360a","response_hash":"cc3c15fbdc0d62f082b50e1d566174c1878b002d5a83428622b0e5d7cc5d4094"},"model":"shared-model","output":"response b","prompt":"[{\"content\":\"frozen v0.3 request\",\"role\":\"user\"}]","schema_version":"ai_output_v1","ts_utc":"2026-08-27T00:00:00Z"}
