{"metadata":{"binding_hash":"9a23baeda72a83f7aa19d3add5c0fbd3bbafe0154f08690e78ddc86a3a73301b","invocation_binding":{"format":"aelitium-invocation-binding-v1","hash_sha256":"0d8aff998187eb3849bbdfb947be5c2a77c7408ea28ba20f4804e4690f15beba","invocation_hash":"e2149c0d3002db2194c397ca1fa3e514db0e2d180119f542292b70b09cc432ba","response_hash":"2ea2b68d227745ccf61014d4282578a41cffa61e8ae28876f6c841d433a2b855"},"invocation_identity":{"format":"aelitium-invocation-v1","hash_sha256":"e2149c0d3002db2194c397ca1fa3e514db0e2d180119f542292b70b09cc432ba","mode":"sync_non_streaming","request":{"messages":[{"content":"frozen v0.3 request","role":"user"}],"model":"shared-model"},"surface":"openai.chat.completions"},"provider":"compare-test","request_hash":"31cd3d3a9bd0a9af3230b247495f253b8fe3331f6efb4bee8bce4f4a3ac3360a","response_hash":"2ea2b68d227745ccf61014d4282578a41cffa61e8ae28876f6c841d433a2b855"},"model":"shared-model","output":"response a","prompt":"[{\"content\":\"frozen v0.3 request\",\"role\":\"user\"}]","schema_version":"ai_output_v1","ts_utc":"2026-08-27T00:00:00Z"}
