{"metadata":{"binding_hash":"41d1fa9b004dd7b85294314fe41fe0883edb2f01aa6688b1f669ffb28d417f28","invocation_binding":{"format":"aelitium-invocation-binding-v1","hash_sha256":"caef7cad89821a091b7028d50a6df9106c1422e1974b842f8628a27b8b70f5dc","invocation_hash":"a670b1c4f3ea4572e214eb06910a8dc6eacff532a8efed23c81b53795a4f5e17","response_hash":"31a1f58bb74345f5ae9bee639fc69ba7ce8e32d629df80763ba036ec4f25ebf3"},"invocation_identity":{"format":"aelitium-invocation-v1","hash_sha256":"a670b1c4f3ea4572e214eb06910a8dc6eacff532a8efed23c81b53795a4f5e17","mode":"sync_non_streaming","request":{"messages":[{"content":"Answer with one short sentence.","role":"system"},{"content":"What color is the clear daytime sky?","role":"user"}],"model":"fixture-request-model","parameters":{"temperature":0.0}},"surface":"litellm.completion"},"request_hash":"064b86344906ecb18784706b4b4ce9a93fb9fc39aeb80228a6e1df962d942a72","response_hash":"31a1f58bb74345f5ae9bee639fc69ba7ce8e32d629df80763ba036ec4f25ebf3"},"model":"fixture-response-model","output":"The clear daytime sky often appears azure.","prompt":"What color is the clear daytime sky?","schema_version":"ai_output_v1","ts_utc":"2026-01-15T12:00:00Z"}
