{"metadata":{"binding_hash":"3aff01918b18cc9d07f50d931ba123d920c958cfcfecafb7745a48845949bcf1","invocation_binding":{"format":"aelitium-invocation-binding-v1","hash_sha256":"5d4bff4a719070acf90c3e991b89e8c99c826f6933d94db92391bfcd3b0c75d1","invocation_hash":"1384d5359b77b3309df456ae8f1882b3dfdee78ab04185f61d3bee5f2ef352fc","response_hash":"3f9db8159050f06c571dd6c8e65c3c35a2110ced95e7fe39b96bda6fe7bac06a"},"invocation_identity":{"format":"aelitium-invocation-v1","hash_sha256":"1384d5359b77b3309df456ae8f1882b3dfdee78ab04185f61d3bee5f2ef352fc","mode":"sync_non_streaming","request":{"messages":[{"content":"Answer with exactly one word.","role":"system"},{"content":"What color is the clear daytime sky?","role":"user"}],"model":"fixture-request-model","parameters":{"temperature":0.0}},"surface":"litellm.completion"},"request_hash":"93e69e82b156f03642db66fccb9dbdeb53ca77908eba8463113614fe11902de0","response_hash":"3f9db8159050f06c571dd6c8e65c3c35a2110ced95e7fe39b96bda6fe7bac06a"},"model":"fixture-response-model","output":"The clear daytime sky appears blue.","prompt":"What color is the clear daytime sky?","schema_version":"ai_output_v1","ts_utc":"2026-01-15T12:00:00Z"}
