{"metadata":{"binding_hash":"da48cb2681cb023b73b53ec83368b76727b06b00dad6fad6a1b64ebf642a0dc5","invocation_binding":{"format":"aelitium-invocation-binding-v1","hash_sha256":"64ae581ad14c27b097f1c79d38244ad661b6e8235c3738d3c252c912630435ca","invocation_hash":"a670b1c4f3ea4572e214eb06910a8dc6eacff532a8efed23c81b53795a4f5e17","response_hash":"3f9db8159050f06c571dd6c8e65c3c35a2110ced95e7fe39b96bda6fe7bac06a"},"invocation_identity":{"format":"aelitium-invocation-v1","hash_sha256":"a670b1c4f3ea4572e214eb06910a8dc6eacff532a8efed23c81b53795a4f5e17","mode":"sync_non_streaming","request":{"messages":[{"content":"Answer with one short sentence.","role":"system"},{"content":"What color is the clear daytime sky?","role":"user"}],"model":"fixture-request-model","parameters":{"temperature":0.0}},"surface":"litellm.completion"},"request_hash":"064b86344906ecb18784706b4b4ce9a93fb9fc39aeb80228a6e1df962d942a72","response_hash":"3f9db8159050f06c571dd6c8e65c3c35a2110ced95e7fe39b96bda6fe7bac06a"},"model":"fixture-response-model","output":"The clear daytime sky appears cyan.","prompt":"What color is the clear daytime sky?","schema_version":"ai_output_v1","ts_utc":"2026-01-15T12:00:00Z"}
