{"metadata":{"binding_hash":"ffef7ea10038b83e5fd89bdd983cfaa8274b1eb8a3e566e72292d5a8a4dcfacf","provider":"demo","request_hash":"7b30b0d200b7c4b0bd33f10982cc49d96202fa03848c45cf5a076777662bbba3","response_hash":"2f1563cc8c0b7b7195786ec487094db12fcdb767985c0da00df66dfd84ef0d14"},"model":"gpt-4o","output":"The sky appears blue because molecules in the atmosphere scatter shorter blue wavelengths of sunlight more than longer red wavelengths.","prompt":"[{\"content\":\"Explain in one sentence why the sky is blue.\",\"role\":\"user\"}]","schema_version":"ai_output_v1","ts_utc":"2026-03-01T10:00:00Z"}
