{"metadata":{"binding_hash":"a236d6c96af0ae87c361748d0414cc8ed81365e5bfe1aa19e05af30699063e25","invocation_binding":{"format":"aelitium-invocation-binding-v1","hash_sha256":"54e79707d7c7782cc20777e63813de9a92b452a868c82d69f5c2e11cc844828f","invocation_hash":"18386be65e0574703422d39345d7c5d0883baf4a7ff80be53d2b83dc8dab2652","response_hash":"3f9db8159050f06c571dd6c8e65c3c35a2110ced95e7fe39b96bda6fe7bac06a"},"invocation_identity":{"format":"aelitium-invocation-v1","hash_sha256":"18386be65e0574703422d39345d7c5d0883baf4a7ff80be53d2b83dc8dab2652","mode":"sync_non_streaming","request":{"messages":[{"content":"Answer with one short sentence.","role":"system"},{"content":"What color is the clear daytime sky?","role":"user"}],"model":"fixture-request-model-v2","parameters":{"temperature":0.0}},"surface":"litellm.completion"},"request_hash":"d603f2c396ada389412986d076132f2a708e6aa1318c23190054c2b395b1c697","response_hash":"3f9db8159050f06c571dd6c8e65c3c35a2110ced95e7fe39b96bda6fe7bac06a"},"model":"fixture-response-model","output":"The clear daytime sky appears blue.","prompt":"What color is the clear daytime sky?","schema_version":"ai_output_v1","ts_utc":"2026-01-15T12:00:00Z"}
