{"metadata":{"binding_hash":"45255ba52c9225419ddf18152beef232803b79c551d642aa7256ec720b41d631","provider":"demo","request_hash":"7b30b0d200b7c4b0bd33f10982cc49d96202fa03848c45cf5a076777662bbba3","response_hash":"7805406968576ea00029594038952f95f834b49e651efa93bee878b6a15d9a58"},"model":"gpt-4o","output":"Sunlight scatters off nitrogen and oxygen molecules, and blue light scatters more than red, making the sky look blue.","prompt":"[{\"content\":\"Explain in one sentence why the sky is blue.\",\"role\":\"user\"}]","schema_version":"ai_output_v1","ts_utc":"2026-03-01T10:00:00Z"}
