{"metadata":{"binding_hash":"0d0853c8387b649208b22d0c42651a0e7459d50cd9db0b4aec04eda3905953c5","invocation_binding":{"format":"aelitium-invocation-binding-v1","hash_sha256":"3a438a1da08390c6426c161f3a0060ce044da06b50b6eb65ac323901d766e242","invocation_hash":"277fec7708e4b383cdb76310f71ee5c82fde64440adf06a4d82adab20b40ddcf","response_hash":"a74bd303427b58660433525467f95f88e117479d4af7cd2ad590a9e9e9127ebf"},"invocation_identity":{"format":"aelitium-invocation-v1","hash_sha256":"277fec7708e4b383cdb76310f71ee5c82fde64440adf06a4d82adab20b40ddcf","mode":"sync_non_streaming","request":{"messages":[{"content":"Answer with one short sentence.","role":"system"},{"content":"What color is the clear daytime sky?","role":"user"}],"model":"rewritten-request-model","parameters":{"temperature":0.75}},"surface":"litellm.completion"},"request_hash":"9ca5eace6d8b49af25a88029d22b4c728a2f9eccdd537b9215603f4e95a32685","response_hash":"a74bd303427b58660433525467f95f88e117479d4af7cd2ad590a9e9e9127ebf"},"model":"rewritten-response-model","output":"A replacement artifact can remain internally consistent.","prompt":"What color is the clear daytime sky?","schema_version":"ai_output_v1","ts_utc":"2026-01-15T12:00:00Z"}
