{"metadata":{"binding_hash":"da48cb2681cb023b73b53ec83368b76727b06b00dad6fad6a1b64ebf642a0dc5","invocation_binding":{"format":"aelitium-invocation-binding-v1","hash_sha256":"97f83d04bdfc7eda5c5bdbd267a8e05bfea0c72c9cb03e16994441bfcad6b4cd","invocation_hash":"4db366d5268e18537ce263f7b0ff7074940c463368fb39b8dc21c34f1aad3f19","response_hash":"3f9db8159050f06c571dd6c8e65c3c35a2110ced95e7fe39b96bda6fe7bac06a"},"invocation_identity":{"format":"aelitium-invocation-v1","hash_sha256":"4db366d5268e18537ce263f7b0ff7074940c463368fb39b8dc21c34f1aad3f19","mode":"sync_non_streaming","request":{"messages":[{"content":"Answer with one short sentence.","role":"system"},{"content":"What color is the clear daytime sky?","role":"user"}],"model":"fixture-request-model","parameters":{"max_tokens":1024}},"surface":"anthropic.messages"},"request_hash":"064b86344906ecb18784706b4b4ce9a93fb9fc39aeb80228a6e1df962d942a72","response_hash":"3f9db8159050f06c571dd6c8e65c3c35a2110ced95e7fe39b96bda6fe7bac06a"},"model":"fixture-response-model","output":"The clear daytime sky appears blue.","prompt":"What color is the clear daytime sky?","schema_version":"ai_output_v1","ts_utc":"2026-01-15T12:00:00Z"}
